{
  "schema": "casegraphen.experimental.verification_policy.v0",
  "verification_policy_id": "verification:security-finding",
  "producer_constraints": {"capability_ids": ["capability:research"]},
  "verifier_constraints": {"capability_ids": ["capability:review"]},
  "actor_must_differ": true,
  "lenses": ["correctness", "source-validity", "recency"],
  "quorum": {"minimum_accepts": 2, "total_verifiers": 3},
  "required_anchors": ["anchor:source"],
  "allowed_runtime_attestations": ["separate_session"],
  "provenance": {"source": "issue:51", "created_by": "actor:designer"}
}
